13:22:42.751101 IP6 fe80::8470:8ff:feaa:6573 > ff02::2: ICMP6, router solicitation, length 16
13:22:43.465922 ARP, Request who-has 172.16.1.2 tell 172.16.1.1, length 28
13:22:43.465953 ARP, Reply 172.16.1.2 is-at b6:fd:be:97:3f:a7, length 28
13:22:43.465961 IP 172.16.1.1.34108 > 8.8.8.8.33434: UDP, length 32
13:22:43.466090 IP 172.16.1.2 > 172.16.1.1: ICMP time exceeded in-transit, length 68
13:22:43.466192 IP 172.16.1.1.53658 > 8.8.8.8.33435: UDP, length 32
13:22:43.466213 IP 172.16.1.2 > 172.16.1.1: ICMP time exceeded in-transit, length 68
13:22:43.466262 IP 172.16.1.1.41879 > 8.8.8.8.33436: UDP, length 32
13:22:43.466275 IP 172.16.1.2 > 172.16.1.1: ICMP time exceeded in-transit, length 68
13:22:43.466319 IP 172.16.1.1.51362 > 8.8.8.8.33437: UDP, length 32
13:22:43.466392 IP 172.17.0.1 > 172.16.1.1: ICMP time exceeded in-transit, length 68
13:22:43.466442 IP 172.16.1.1.33678 > 8.8.8.8.33438: UDP, length 32
13:22:43.466476 IP 172.17.0.1 > 172.16.1.1: ICMP time exceeded in-transit, length 68
13:22:43.466525 IP 172.16.1.1.38907 > 8.8.8.8.33439: UDP, length 32
13:22:43.466569 IP 172.17.0.1 > 172.16.1.1: ICMP time exceeded in-transit, length 68
13:22:43.466617 IP 172.16.1.1.38131 > 8.8.8.8.33440: UDP, length 32
13:22:43.466720 IP 172.16.1.1.38105 > 8.8.8.8.33441: UDP, length 32
13:22:43.466854 IP 172.16.1.1.45537 > 8.8.8.8.33442: UDP, length 32
13:22:43.466979 IP 192.168.122.1 > 172.16.1.1: ICMP time exceeded in-transit, length 68
13:22:43.466985 IP 192.168.122.1 > 172.16.1.1: ICMP time exceeded in-transit, length 68
13:22:43.467029 IP 192.168.122.1 > 172.16.1.1: ICMP time exceeded in-transit, length 68
13:22:43.467079 IP 172.16.1.1.39806 > 8.8.8.8.33443: UDP, length 32
13:22:43.467165 IP 172.16.1.1.42635 > 8.8.8.8.33444: UDP, length 32
13:22:43.467252 IP 172.16.1.1.60579 > 8.8.8.8.33445: UDP, length 32
13:22:43.467394 IP 172.16.1.1.36598 > 8.8.8.8.33446: UDP, length 32
13:22:43.467484 IP 172.16.1.1.52260 > 8.8.8.8.33447: UDP, length 32
13:22:43.467571 IP 172.16.1.1.33826 > 8.8.8.8.33448: UDP, length 32
13:22:43.467674 IP 172.16.1.1.44627 > 8.8.8.8.33449: UDP, length 32
13:22:43.467806 IP 142.104.74.65 > 172.16.1.1: ICMP time exceeded in-transit, length 36
13:22:43.467816 IP 142.104.74.65 > 172.16.1.1: ICMP time exceeded in-transit, length 36
13:22:43.468016 IP 142.104.74.65 > 172.16.1.1: ICMP time exceeded in-transit, length 36
13:22:43.468143 IP 142.104.124.105 > 172.16.1.1: ICMP time exceeded in-transit, length 36
13:22:43.468241 IP 142.104.124.105 > 172.16.1.1: ICMP time exceeded in-transit, length 36
13:22:43.468248 IP 142.104.124.105 > 172.16.1.1: ICMP time exceeded in-transit, length 36
13:22:43.468272 IP 142.104.100.241 > 172.16.1.1: ICMP time exceeded in-transit, length 36
13:22:43.468793 IP 172.16.1.1.15322 > 192.203.230.10.53: 34671 PTR? 2.1.16.172.in-addr.arpa. (41)
13:22:43.472778 IP 192.203.230.10.53 > 172.16.1.1.15322: 34671- 0/6/12 (417)
13:22:43.472924 IP 172.16.1.1.15267 > 199.253.183.183.53: 53863 PTR? 2.1.16.172.in-addr.arpa. (41)
13:22:43.649955 IP 199.253.183.183.53 > 172.16.1.1.15267: 53863- 0/6/0 (161)
13:22:43.650347 IP 172.16.1.1.15589 > 193.0.14.129.53: 57825 A? y.arin.net. (28)
13:22:43.655139 IP 193.0.14.129.53 > 172.16.1.1.15589: 57825- 0/13/14 (491)
13:22:43.655541 IP 172.16.1.1.17647 > 192.5.6.30.53: 45120 A? y.arin.net. (28)
13:22:43.661401 IP 192.5.6.30.53 > 172.16.1.1.17647: 45120- 0/4/8 (274)
13:22:46.735709 IP 172.16.1.1.18981 > 199.71.0.108.53: 36669 [b2&3=0x80] A? y.arin.net. (28)
13:22:46.762213 IP 199.71.0.108.53 > 172.16.1.1.18981: 36669*- 1/0/0 A 192.82.134.30 (44)
13:22:46.762525 IP 172.16.1.1.18626 > 192.82.134.30.53: 16311 PTR? 2.1.16.172.in-addr.arpa. (41)
13:22:46.767813 IP 192.82.134.30.53 > 172.16.1.1.18626: 16311- 0/2/0 (101)
13:22:46.768187 IP 172.16.1.1.16005 > 192.33.4.12.53: 42905 A? blackhole-2.iana.org. (38)
13:22:46.826895 IP 192.33.4.12.53 > 172.16.1.1.16005: 42905- 0/6/12 (446)
13:22:46.827279 IP 172.16.1.1.18694 > 199.249.112.1.53: 30134 A? blackhole-2.iana.org. (38)
13:22:46.830869 IP 199.249.112.1.53 > 172.16.1.1.18694: 30134- 0/4/2 (172)
13:22:46.831222 IP 172.16.1.1.16945 > 192.55.83.30.53: 28527 A? c.iana-servers.net. (36)
13:22:46.839556 IP 192.55.83.30.53 > 172.16.1.1.16945: 28527- 0/4/6 (240)
13:22:46.839877 IP 172.16.1.1.16877 > 199.43.134.53.53: 45767 A? blackhole-2.iana.org. (38)
13:22:46.875894 IP 199.43.134.53.53 > 172.16.1.1.16877: 45767*- 1/0/0 A 192.175.48.42 (54)
13:22:46.876210 IP 172.16.1.1.17888 > 192.175.48.42.53: 60807 PTR? 2.1.16.172.in-addr.arpa. (41)
13:22:46.881201 IP 192.175.48.42.53 > 172.16.1.1.17888: 60807 NXDomain*- 0/1/0 (118)
13:22:46.888972 IP 172.16.1.1.15444 > 199.212.0.108.53: 40546 A? r.arin.net. (28)
13:22:46.950429 IP 199.212.0.108.53 > 172.16.1.1.15444: 40546*- 1/0/0 A 199.180.180.63 (44)
13:22:46.950703 IP 172.16.1.1.17253 > 199.180.180.63.53: 49190 PTR? 1.0.17.172.in-addr.arpa. (41)
13:22:46.956438 IP 199.180.180.63.53 > 172.16.1.1.17253: 49190- 0/2/0 (120)
13:22:48.638926 ARP, Request who-has 172.16.1.1 tell 172.16.1.2, length 28
13:22:48.639008 ARP, Reply 172.16.1.1 is-at 86:70:08:aa:65:73, length 28
13:22:51.894502 IP 172.16.1.1.17567 > 199.212.0.108.53: 57434 A? z.arin.net. (28)
13:22:51.957269 IP 199.212.0.108.53 > 172.16.1.1.17567: 57434*- 1/0/0 A 199.180.180.63 (44)
13:22:51.957528 IP 172.16.1.1.17345 > 199.180.180.63.53: 65213 PTR? 1.0.17.172.in-addr.arpa. (41)
13:22:51.963036 IP 199.180.180.63.53 > 172.16.1.1.17345: 65213- 0/2/0 (120)
13:22:56.899999 IP 172.16.1.1.15460 > 200.10.60.53.53: 20596 PTR? 1.122.168.192.in-addr.arpa. (44)
13:22:57.008842 IP 200.10.60.53.53 > 172.16.1.1.15460: 20596- 0/6/0 (183)
13:22:57.009096 IP 172.16.1.1.17677 > 204.61.216.50.53: 52490 A? x.arin.net. (28)
13:22:57.014684 IP 204.61.216.50.53 > 172.16.1.1.17677: 52490*- 1/4/8 A 199.180.180.63 (290)
13:22:57.014953 IP 172.16.1.1.16945 > 199.180.180.63.53: 36496 PTR? 1.122.168.192.in-addr.arpa. (44)
13:22:57.021264 IP 199.180.180.63.53 > 172.16.1.1.16945: 36496- 0/2/0 (124)
13:22:57.021488 IP 172.16.1.1.15713 > 192.54.112.30.53: 2067 A? a.iana-servers.net. (36)
13:22:57.058686 IP 192.54.112.30.53 > 172.16.1.1.15713: 2067- 0/4/6 (240)
13:23:01.902371 IP 172.16.1.1.15710 > 199.4.138.53.53: 47301 A? blackhole-1.iana.org. (38)
13:23:01.934685 IP 199.4.138.53.53 > 172.16.1.1.15710: 47301*- 1/4/0 A 192.175.48.6 (141)
13:23:01.934968 IP 172.16.1.1.17369 > 192.175.48.6.53: 15983 PTR? 1.122.168.192.in-addr.arpa. (44)
13:23:01.938808 IP 192.175.48.6.53 > 172.16.1.1.17369: 15983 NXDomain*- 0/1/0 (121)
13:23:06.908280 IP 172.16.1.1.17642 > 200.10.60.53.53: 39725 PTR? 65.74.104.142.in-addr.arpa. (44)
13:23:07.019186 IP 200.10.60.53.53 > 172.16.1.1.17642: 39725- 0/6/0 (183)
13:23:07.019465 IP 172.16.1.1.18378 > 192.31.80.30.53: 53867 A? arin.authdns.ripe.net. (39)
13:23:07.025558 IP 192.31.80.30.53 > 172.16.1.1.18378: 53867- 0/5/10 (379)
13:23:09.089178 IP 172.16.1.1.16345 > 200.3.13.14.53: 49555 [b2&3=0x80] A? arin.authdns.ripe.net. (39)
13:23:09.270702 IP 200.3.13.14.53 > 172.16.1.1.16345: 49555*- 1/0/0 A 193.0.9.10 (55)
13:23:09.270934 IP 172.16.1.1.17114 > 193.0.9.10.53: 31867 PTR? 65.74.104.142.in-addr.arpa. (44)
13:23:09.401297 IP 193.0.9.10.53 > 172.16.1.1.17114: 31867- 0/3/0 (127)
13:23:09.401545 IP 172.16.1.1.15742 > 192.228.79.201.53: 18365 A? ns3.uvic.ca. (29)
13:23:09.433439 IP 192.228.79.201.53 > 172.16.1.1.15742: 18365- 0/4/8 (282)
13:23:10.489357 IP 172.16.1.1.17003 > 198.182.167.1.53: 62047 [b2&3=0x80] A? ns3.uvic.ca. (29)
13:23:10.494680 IP 198.182.167.1.53 > 172.16.1.1.17003: 62047- 0/3/3 (129)
13:23:10.494919 IP 172.16.1.1.18389 > 216.171.224.23.53: 10098 PTR? 65.74.104.142.in-addr.arpa. (44)
13:23:11.913723 IP 172.16.1.1.45855 > 8.8.8.8.33450: UDP, length 32
13:23:11.913951 IP 172.16.1.1.40242 > 8.8.8.8.33451: UDP, length 32
13:23:11.914050 IP 172.16.1.1.51496 > 8.8.8.8.33452: UDP, length 32
13:23:11.914144 IP 172.16.1.1.55112 > 8.8.8.8.33453: UDP, length 32
13:23:11.914232 IP 172.16.1.1.58618 > 8.8.8.8.33454: UDP, length 32
13:23:11.914325 IP 172.16.1.1.60795 > 8.8.8.8.33455: UDP, length 32
13:23:11.914413 IP 172.16.1.1.47089 > 8.8.8.8.33456: UDP, length 32
13:23:11.914506 IP 172.16.1.1.44168 > 8.8.8.8.33457: UDP, length 32
13:23:11.914614 IP 142.104.100.241 > 172.16.1.1: ICMP time exceeded in-transit, length 36
13:23:11.914620 IP 142.104.100.241 > 172.16.1.1: ICMP time exceeded in-transit, length 36
13:23:11.914681 IP 172.16.1.1.39338 > 8.8.8.8.33458: UDP, length 32
13:23:11.914836 IP 172.16.1.1.47233 > 8.8.8.8.33459: UDP, length 32
13:23:11.914927 IP 172.16.1.1.53644 > 8.8.8.8.33460: UDP, length 32
13:23:11.915010 IP 172.16.1.1.55114 > 8.8.8.8.33461: UDP, length 32
13:23:11.915405 IP 142.104.100.189 > 172.16.1.1: ICMP time exceeded in-transit, length 68
13:23:11.915412 IP 142.104.100.189 > 172.16.1.1: ICMP time exceeded in-transit, length 68
13:23:11.915417 IP 142.104.100.189 > 172.16.1.1: ICMP time exceeded in-transit, length 68
13:23:11.915894 IP 207.23.244.233 > 172.16.1.1: ICMP time exceeded in-transit, length 36
13:23:11.915903 IP 207.23.244.233 > 172.16.1.1: ICMP time exceeded in-transit, length 36
13:23:11.915908 IP 207.23.244.233 > 172.16.1.1: ICMP time exceeded in-transit, length 36
13:23:11.916134 IP 199.212.24.98 > 172.16.1.1: ICMP time exceeded in-transit, length 68
13:23:11.916501 IP 199.212.24.98 > 172.16.1.1: ICMP time exceeded in-transit, length 68
13:23:11.916510 IP 199.212.24.98 > 172.16.1.1: ICMP time exceeded in-transit, length 68
13:23:11.918898 IP 199.212.24.228 > 172.16.1.1: ICMP time exceeded in-transit, length 68
13:23:13.074976 IP 172.16.1.1.15929 > 192.175.48.42.53: 17069 [b2&3=0x80] PTR? 1.122.168.192.in-addr.arpa. (44)
13:23:13.079302 IP 192.175.48.42.53 > 172.16.1.1.15929: 17069 NXDomain*- 0/1/0 (121)
13:23:16.920988 IP 172.16.1.1.18912 > 198.182.167.1.53: 14460 A? dns2.uvic.ca. (30)
13:23:16.926451 IP 198.182.167.1.53 > 172.16.1.1.18912: 14460- 0/3/3 (129)
13:23:16.926661 IP 172.16.1.1.16663 > 142.104.80.2.53: 20144 PTR? 105.124.104.142.in-addr.arpa. (46)
13:23:16.927866 IP 142.104.80.2.53 > 172.16.1.1.16663: 20144 NXDomain* 0/1/0 (103)
13:23:21.926666 IP 172.16.1.1.16649 > 216.171.224.23.53: 22481 PTR? 241.100.104.142.in-addr.arpa. (46)
13:23:22.985364 IP 172.16.1.1.17276 > 142.104.80.2.53: 7831 [b2&3=0x80] PTR? 241.100.104.142.in-addr.arpa. (46)
13:23:22.986595 IP 142.104.80.2.53 > 172.16.1.1.17276: 7831 NXDomain* 0/1/0 (103)
13:23:22.987017 IP 172.16.1.1.54658 > 8.8.8.8.33462: UDP, length 32
13:23:22.987157 IP 172.16.1.1.55242 > 8.8.8.8.33463: UDP, length 32
13:23:22.987244 IP 172.16.1.1.57157 > 8.8.8.8.33464: UDP, length 32
13:23:22.987345 IP 172.16.1.1.49529 > 8.8.8.8.33465: UDP, length 32
13:23:22.987434 IP 172.16.1.1.53754 > 8.8.8.8.33466: UDP, length 32
13:23:22.987523 IP 172.16.1.1.40336 > 8.8.8.8.33467: UDP, length 32
13:23:22.988012 IP 172.16.1.1.15164 > 199.4.144.2.53: 48923 A? dns1.uvic.ca. (30)
13:23:22.990822 IP 199.212.24.229 > 172.16.1.1: ICMP time exceeded in-transit, length 36
13:23:22.990834 IP 199.212.24.229 > 172.16.1.1: ICMP time exceeded in-transit, length 36
13:23:22.990839 IP 199.212.24.228 > 172.16.1.1: ICMP time exceeded in-transit, length 68
13:23:22.990843 IP 199.212.24.228 > 172.16.1.1: ICMP time exceeded in-transit, length 68
13:23:22.990848 IP 199.212.24.229 > 172.16.1.1: ICMP time exceeded in-transit, length 36
13:23:22.992298 IP 74.125.243.177 > 172.16.1.1: ICMP time exceeded in-transit, length 76
13:23:23.042462 IP 199.4.144.2.53 > 172.16.1.1.15164: 48923- 0/3/3 (129)
13:23:23.042671 IP 172.16.1.1.17828 > 142.104.6.1.53: 37241 PTR? 189.100.104.142.in-addr.arpa. (46)
13:23:23.043787 IP 142.104.6.1.53 > 172.16.1.1.17828: 37241* 1/2/2 PTR cle-core-edge.bb.uvic.ca. (154)
13:23:25.463033 IP 172.16.1.1.16221 > 142.104.80.2.53: 11563 [b2&3=0x80] PTR? 65.74.104.142.in-addr.arpa. (44)
13:23:25.464368 IP 142.104.80.2.53 > 172.16.1.1.16221: 11563* 1/5/5 PTR n-gateway.csc.uvic.ca. (256)
13:23:27.038884 ARP, Request who-has 172.16.1.2 tell 172.16.1.1, length 28
13:23:27.038997 ARP, Reply 172.16.1.2 is-at b6:fd:be:97:3f:a7, length 28
13:23:27.983960 IP 172.16.1.1.15725 > 216.171.224.23.53: 52086 [b2&3=0x80] PTR? 105.124.104.142.in-addr.arpa. (46)
13:23:27.993392 IP 172.16.1.1.18839 > 216.171.224.23.53: 51941 PTR? 189.100.104.142.in-addr.arpa. (46)
13:23:28.063068 ARP, Request who-has 172.16.1.1 tell 172.16.1.2, length 28
13:23:28.063115 ARP, Reply 172.16.1.1 is-at 86:70:08:aa:65:73, length 28
13:23:29.001041 IP 172.16.1.1.16443 > 142.104.80.2.53: 53417 [b2&3=0x80] PTR? 105.124.104.142.in-addr.arpa. (46)
13:23:29.002440 IP 142.104.80.2.53 > 172.16.1.1.16443: 53417 NXDomain* 0/1/0 (103)
13:23:29.002605 IP 172.16.1.1.15404 > 142.104.80.2.53: 53485 [b2&3=0x80] PTR? 189.100.104.142.in-addr.arpa. (46)
13:23:29.003855 IP 142.104.80.2.53 > 172.16.1.1.15404: 53485* 1/2/2 PTR cle-core-edge.bb.uvic.ca. (154)
13:23:29.005452 IP 172.16.1.1.16917 > 193.0.9.1.53: 35564 PTR? 233.244.23.207.in-addr.arpa. (45)
13:23:29.135758 IP 193.0.9.1.53 > 172.16.1.1.16917: 35564- 0/6/0 (165)
13:23:29.136011 IP 172.16.1.1.15589 > 193.0.9.10.53: 34141 PTR? 233.244.23.207.in-addr.arpa. (45)
13:23:29.267174 IP 193.0.9.10.53 > 172.16.1.1.15589: 34141- 0/4/0 (126)
13:23:29.267444 IP 172.16.1.1.18416 > 192.42.93.30.53: 41759 A? jade.bc.net. (29)
13:23:29.300725 IP 192.42.93.30.53 > 172.16.1.1.18416: 41759- 0/2/2 (97)
13:23:29.300938 IP 172.16.1.1.18298 > 134.87.112.5.53: 30771 A? jade.bc.net. (29)
13:23:29.304807 IP 134.87.112.5.53 > 172.16.1.1.18298: 30771*- 1/0/0 A 128.189.4.1 (45)
13:23:29.304981 IP 172.16.1.1.17305 > 128.189.4.1.53: 9766 PTR? 233.244.23.207.in-addr.arpa. (45)
13:23:35.069433 IP 172.16.1.1.15749 > 134.87.112.5.53: 29036 A? ns6.bc.net. (28)
13:23:35.073059 IP 134.87.112.5.53 > 172.16.1.1.15749: 29036*- 1/0/0 A 134.87.112.5 (44)
13:23:36.019572 IP 172.16.1.1.17001 > 134.87.112.5.53: 64376 A? ns5.bc.net. (28)
13:23:36.019646 IP 172.16.1.1.17479 > 128.189.4.5.53: 58355 [b2&3=0x80] A? ns6.bc.net. (28)
13:23:36.023088 IP 134.87.112.5.53 > 172.16.1.1.17001: 64376*- 1/0/0 A 128.189.4.5 (44)
13:23:36.027363 IP 128.189.4.5.53 > 172.16.1.1.17479: 58355*- 1/0/0 A 134.87.112.5 (44)
13:23:37.085151 IP 172.16.1.1.17349 > 128.189.4.5.53: 62083 A? wedge.bc.net. (30)
13:23:37.085319 IP 172.16.1.1.17503 > 128.189.4.5.53: 58309 [b2&3=0x80] A? ns5.bc.net. (28)
13:23:37.093343 IP 128.189.4.5.53 > 172.16.1.1.17349: 62083*- 1/0/0 A 134.87.112.1 (46)
13:23:37.093354 IP 128.189.4.5.53 > 172.16.1.1.17503: 58309*- 1/0/0 A 128.189.4.5 (44)
13:23:37.093520 IP 172.16.1.1.15885 > 134.87.112.1.53: 11951 PTR? 233.244.23.207.in-addr.arpa. (45)
13:23:38.101903 IP 172.16.1.1.18812 > 128.189.4.1.53: 57019 [b2&3=0x80] PTR? 233.244.23.207.in-addr.arpa. (45)
13:23:38.102081 IP 172.16.1.1.18255 > 134.87.112.5.53: 65112 [b2&3=0x80] A? ns5.bc.net. (28)
13:23:38.106017 IP 134.87.112.5.53 > 172.16.1.1.18255: 65112*- 1/0/0 A 128.189.4.5 (44)
13:23:39.014193 IP 172.16.1.1.41989 > 8.8.8.8.33468: UDP, length 32
13:23:39.014407 IP 172.16.1.1.42566 > 8.8.8.8.33469: UDP, length 32
13:23:39.014602 IP 172.16.1.1.37672 > 8.8.8.8.33470: UDP, length 32
13:23:39.014854 IP 172.16.1.1.34177 > 8.8.8.8.33471: UDP, length 32
13:23:39.014985 IP 172.16.1.1.60051 > 8.8.8.8.33472: UDP, length 32
13:23:39.015133 IP 172.16.1.1.40346 > 8.8.8.8.33473: UDP, length 32
13:23:39.015279 IP 172.16.1.1.44227 > 8.8.8.8.33474: UDP, length 32
13:23:39.015430 IP 172.16.1.1.38858 > 8.8.8.8.33475: UDP, length 32
13:23:39.015576 IP 172.16.1.1.35895 > 8.8.8.8.33476: UDP, length 32
13:23:39.015707 IP 172.16.1.1.33964 > 8.8.8.8.33477: UDP, length 32
13:23:39.017266 IP 172.16.1.1.15645 > 193.0.9.1.53: 12691 PTR? 177.243.125.74.in-addr.arpa. (45)
13:23:39.018178 IP 142.251.50.177 > 172.16.1.1: ICMP time exceeded in-transit, length 68
13:23:39.018977 IP 8.8.8.8 > 172.16.1.1: ICMP 8.8.8.8 udp port 33473 unreachable, length 36
13:23:39.018987 IP 142.251.50.177 > 172.16.1.1: ICMP time exceeded in-transit, length 68
13:23:39.018991 IP 216.239.43.231 > 172.16.1.1: ICMP time exceeded in-transit, length 68
13:23:39.018996 IP 8.8.8.8 > 172.16.1.1: ICMP 8.8.8.8 udp port 33474 unreachable, length 36
13:23:39.019000 IP 74.125.243.177 > 172.16.1.1: ICMP time exceeded in-transit, length 76
13:23:39.019069 IP 8.8.8.8 > 172.16.1.1: ICMP 8.8.8.8 udp port 33475 unreachable, length 36
13:23:39.019074 IP 74.125.243.177 > 172.16.1.1: ICMP time exceeded in-transit, length 76
13:23:39.019079 IP 8.8.8.8 > 172.16.1.1: ICMP 8.8.8.8 udp port 33476 unreachable, length 36
13:23:39.019083 IP 8.8.8.8 > 172.16.1.1: ICMP 8.8.8.8 udp port 33477 unreachable, length 36
13:23:39.118348 IP 172.16.1.1.18149 > 134.87.112.5.53: 23642 [b2&3=0x80] PTR? 233.244.23.207.in-addr.arpa. (45)
13:23:39.122421 IP 134.87.112.5.53 > 172.16.1.1.18149: 23642 NXDomain*- 0/1/0 (104)
13:23:39.145408 IP 193.0.9.1.53 > 172.16.1.1.15645: 12691- 0/6/0 (165)
13:23:39.145766 IP 172.16.1.1.18859 > 193.0.9.10.53: 32202 PTR? 177.243.125.74.in-addr.arpa. (45)
13:23:39.275008 IP 193.0.9.10.53 > 172.16.1.1.18859: 32202- 0/4/0 (127)
13:23:39.275351 IP 172.16.1.1.16789 > 192.36.148.17.53: 54414 A? ns3.google.com. (32)
13:23:39.280278 IP 192.36.148.17.53 > 172.16.1.1.16789: 54414- 0/13/14 (495)
13:23:39.280639 IP 172.16.1.1.15258 > 192.55.83.30.53: 60953 A? ns3.google.com. (32)
13:23:39.289414 IP 192.55.83.30.53 > 172.16.1.1.15258: 60953- 0/4/8 (276)
13:23:39.289713 IP 172.16.1.1.15719 > 216.239.36.10.53: 41839 PTR? 177.243.125.74.in-addr.arpa. (45)
13:23:39.300085 IP 216.239.36.10.53 > 172.16.1.1.15719: 41839 NXDomain*- 0/1/0 (105)
13:23:39.300689 IP 172.16.1.1.59872 > 8.8.8.8.33478: UDP, length 32
13:23:39.300864 IP 172.16.1.1.37097 > 8.8.8.8.33479: UDP, length 32
13:23:39.301034 IP 172.16.1.1.59986 > 8.8.8.8.33480: UDP, length 32
13:23:39.301169 IP 172.16.1.1.33810 > 8.8.8.8.33481: UDP, length 32
13:23:39.301314 IP 172.16.1.1.52150 > 8.8.8.8.33482: UDP, length 32
13:23:39.301451 IP 172.16.1.1.53137 > 8.8.8.8.33483: UDP, length 32
13:23:39.302080 IP 172.16.1.1.15957 > 199.71.0.108.53: 31341 A? u.arin.net. (28)
13:23:39.304416 IP 8.8.8.8 > 172.16.1.1: ICMP 8.8.8.8 udp port 33480 unreachable, length 36
13:23:39.304426 IP 8.8.8.8 > 172.16.1.1: ICMP 8.8.8.8 udp port 33478 unreachable, length 36
13:23:39.304431 IP 8.8.8.8 > 172.16.1.1: ICMP 8.8.8.8 udp port 33479 unreachable, length 36
13:23:39.304461 IP 8.8.8.8 > 172.16.1.1: ICMP 8.8.8.8 udp port 33482 unreachable, length 36
13:23:39.304573 IP 8.8.8.8 > 172.16.1.1: ICMP 8.8.8.8 udp port 33481 unreachable, length 36
13:23:39.304936 IP 8.8.8.8 > 172.16.1.1: ICMP 8.8.8.8 udp port 33483 unreachable, length 36
13:23:39.327727 IP 199.71.0.108.53 > 172.16.1.1.15957: 31341*- 1/0/0 A 204.61.216.50 (44)
13:23:39.328009 IP 172.16.1.1.15528 > 204.61.216.50.53: 43870 PTR? 177.50.251.142.in-addr.arpa. (45)
13:23:39.333020 IP 204.61.216.50.53 > 172.16.1.1.15528: 43870- 0/4/0 (147)
13:23:44.307566 IP 172.16.1.1.17209 > 193.0.9.10.53: 38681 PTR? 177.50.251.142.in-addr.arpa. (45)
13:23:44.439014 IP 193.0.9.10.53 > 172.16.1.1.17209: 38681- 0/4/0 (147)
13:23:44.439342 IP 172.16.1.1.15326 > 192.55.83.30.53: 17325 A? ns2.google.com. (32)
13:23:44.447680 IP 192.55.83.30.53 > 172.16.1.1.15326: 17325- 0/4/8 (276)
13:23:44.447941 IP 172.16.1.1.15177 > 216.239.34.10.53: 40894 PTR? 177.50.251.142.in-addr.arpa. (45)
13:23:44.457215 IP 216.239.34.10.53 > 172.16.1.1.15177: 40894 NXDomain*- 0/1/0 (105)
13:23:44.458022 IP 172.16.1.1.18178 > 199.253.183.183.53: 31691 PTR? 231.43.239.216.in-addr.arpa. (45)
13:23:44.634979 IP 199.253.183.183.53 > 172.16.1.1.18178: 31691- 0/6/0 (165)
13:23:44.635259 IP 172.16.1.1.16417 > 192.82.134.30.53: 1719 PTR? 231.43.239.216.in-addr.arpa. (45)
13:23:44.640679 IP 192.82.134.30.53 > 172.16.1.1.16417: 1719- 0/4/0 (127)
13:23:44.640920 IP 172.16.1.1.18476 > 192.55.83.30.53: 23067 A? ns4.google.com. (32)
13:23:44.649388 IP 192.55.83.30.53 > 172.16.1.1.18476: 23067- 0/4/8 (276)
13:23:44.649600 IP 172.16.1.1.16040 > 216.239.38.10.53: 13922 PTR? 231.43.239.216.in-addr.arpa. (45)
13:23:44.697966 IP 216.239.38.10.53 > 172.16.1.1.16040: 13922 NXDomain*- 0/1/0 (105)
13:23:44.699056 IP 172.16.1.1.16796 > 199.253.183.183.53: 51186 PTR? 8.8.8.8.in-addr.arpa. (38)
13:23:44.863967 IP 199.253.183.183.53 > 172.16.1.1.16796: 51186- 0/6/0 (158)
13:23:44.864212 IP 172.16.1.1.17755 > 192.82.134.30.53: 9053 PTR? 8.8.8.8.in-addr.arpa. (38)
13:23:44.870471 IP 192.82.134.30.53 > 172.16.1.1.17755: 9053- 0/4/0 (120)
13:23:44.870741 IP 172.16.1.1.18115 > 192.55.83.30.53: 31610 A? ns1.google.com. (32)
13:23:44.879070 IP 192.55.83.30.53 > 172.16.1.1.18115: 31610- 0/4/8 (276)
13:23:44.879270 IP 172.16.1.1.17700 > 216.239.32.10.53: 56533 PTR? 8.8.8.8.in-addr.arpa. (38)
13:23:44.904331 IP 216.239.32.10.53 > 172.16.1.1.17700: 56533*- 1/0/0 PTR dns.google. (62)

